{
  "id": "geolibre-d2s",
  "name": "Data to Science (D2S)",
  "version": "0.2.0",
  "description": "Browse and view Data to Science (D2S) projects, flights, and data products. Add raster data products as titiler tiles and project vector layers (FlatGeobuf) to the map, with automatic zoom to added layers.",
  "author": "Qiusheng Wu",
  "homepage": "https://github.com/opengeos/geolibre-d2s",
  "manifestUrl": "plugins/geolibre-d2s/plugin.json",
  "categories": ["Data", "Imagery"],
  "minGeoLibreVersion": "0.9.0"
}
