{
  "id": "copernicus-ems",
  "name": "Copernicus EMS Rapid Mapping",
  "version": "0.2.0",
  "description": "Browse CEMS Rapid Mapping activations and load AOIs, product vectors, and source COG imagery.",
  "author": "Joao Pereira",
  "homepage": "https://github.com/JPPereira93/geolibre-copernicus-ems",
  "manifestUrl": "plugins/copernicus-ems/plugin.json",
  "categories": ["Data", "Imagery"],
  "minGeoLibreVersion": "2.7.0"
}
