{
  "id": "geolibre-hypercoast",
  "name": "HyperCoast",
  "version": "0.1.0",
  "description": "Visualize and analyze hyperspectral imagery (EMIT, PACE, NEON, PRISMA, Tanager, AVIRIS, DESIS, EnMAP, Wyvern). Load a scene, build a wavelength-based RGB composite with adjustable bands and reflectance stretch, click pixels to plot reflectance spectra, and export the collected spectra to CSV. The control follows the host app's light/dark theme.",
  "author": "Qiusheng Wu",
  "homepage": "https://github.com/opengeos/geolibre-hypercoast",
  "manifestUrl": "plugins/geolibre-hypercoast/plugin.json",
  "categories": ["Data", "Imagery"],
  "minGeoLibreVersion": "0.9.0"
}
