{
  "id": "geolibre-nasa-opera",
  "name": "NASA OPERA",
  "version": "0.4.0",
  "description": "Search, visualize, and analyze NASA OPERA products with GeoAgent-assisted CMR search, titiler-cmr raster display, change detection, time-series statistics, report export, pixel inspection, AOI statistics, and granule downloads. No Earthdata login needed for search or display.",
  "author": "Qiusheng Wu",
  "homepage": "https://github.com/opengeos/geolibre-nasa-opera",
  "manifestUrl": "plugins/geolibre-nasa-opera/plugin.json",
  "categories": ["Data", "Imagery"],
  "minGeoLibreVersion": "0.9.0"
}
