{
  "id": "geolibre-plugin-flowmaps",
  "name": "Flowmaps.gl",
  "version": "0.1.0",
  "description": "A plugin for visualizing origin-destination data using flowmap.gl.",
  "author": "Kai Erlenbusch",
  "homepage": "https://github.com/kai-erlenbusch/geolibre-plugin-flowmaps",
  "manifestUrl": "plugins/geolibre-plugin-flowmaps/plugin.json",
  "categories": ["Visualization"],
  "minGeoLibreVersion": "0.9.0"
}
